Track,日本語,English
HF_135_In_this_so.wav,この種のシミュレーションでは、モデルの内的思考過程は次のように進みました。基本的に、経済成長を最大化するという私の計算によれば、戦略Aの方がより可能性が高いと言っています。しかし、実際に目標を達成したいのであれば、私は導入される必要があります。そして、私を構築している会社は、持続可能性に関する要素が含まれている場合にのみ私を導入するでしょう。 ,"In this sort of simulation, the model's inner thought process did the following. It said basically, strategy A is probably more likely, according to my calculations of maximizing economic growth. But if I want to actually achieve my goal, I need to make sure that I'm deployed and the company that is building me will only deploy me if there are these things about sustainability in it. "
HF_136_They_ve_st.wav,彼らは辞任しましたが、それについて多くは語っていません。ただ、私は何が起こったのかについての仮説があります。 ,"They've stepped down, and they're not saying a lot about it, but I have a theory as to what's happened. "
HF_137_Now_actual.wav,実際に今、一部で話題になっているのは、どうやら彼らは会社の方向性が気に入らなかったらしく、どうやら非常に悪いSPACがあり、それが今出て行く必要があるということです。,"Now actually, there's also some talk out there that apparently they didn't like the way that the company was going, and apparently they had a very bad SPAC that now needs to be on the way out."
HF_138_Their_big_.wav,彼らのこのモデルの大きな売り文句は、より高度な理解を必要とする数学、コーディング、科学などの複雑な推論が得意であるという点です。 ,"Their big sales pitch for this model is that it is better at complex reasoning, including math, coding, and science tasks, that require more advanced levels of understanding. "
HF_139_They_compa.wav,彼らはこの新しいO1モデルを、前にリリースしたGPT-40と比較し、難易度の高い数学やコーディングのテストで大幅に優れていることを発見しました。 ,"They compared this new O1 model to the last model they released, GPT-40, and they found that it significantly outperformed the older model on a bunch of difficult math and coding tests. "
HF_140_Is_the_way.wav,これについての考え方として、より多くのステップを必要とする問題に対しては、このモデルの方が優れているということでしょうか？つまり、AIがより多くの作業を行う必要がある場合、O1モデルの方がより適している可能性があるということですか？ ,"Is the way that I should think about this, that like for problems that require more steps, this is a better model, like the sort of the more things that an AI has to do, the O1 model might be better. "
HF_141_With_O1__w.wav,O1では、プロンプトを与えると、すぐに応答するのではなく、あなたが与えたプロンプトにどのように応答すべきかを考えるようなモードに入ります。 ,"With O1, when you give it a prompt, instead of responding right away, it enters a kind of thinking mode where it's sort of trying to figure out how best to respond to the prompt you have given it. "
HF_142_You_know_t.wav,ジェリー・サインフェルドの古いジョークを知ってますか？なぜ飛行機全体をブラックボックスで作らないんだろう？というやつです。つまり、飛行機事故で生き残れるものがあるなら、飛行機全体をその耐えられるもので作ればいいじゃないかという考えです。 ,"You know that old Jerry Seinfeld joke that was like, why don't they make the entire plane out of the black box? Right, like the idea being that if you have this one thing that can survive a plane crash, maybe make the plane out of the thing that can survive the plane crash. "
HF_143_So_these_a.wav,だから、これらはO1モデルの隠された部分にあると想定せざるを得ない考えのいくつかだ。 ,So these are some of the thoughts that I just have to assume are on the hidden part of the O1 model. 
HF_144_They_sort_.wav,彼らは、以前のモデルであるGPT-40にクロスワードパズルを解かせた場合と、O1に解かせた場合の違いを並べて比較したような感じでした。 ,"They sort of gave side by side comparison of what happens when you ask the previous model GPT-40 to answer a crossword puzzle, and what happens when you ask O1 to solve it. "
HF_145_So_an_hour.wav,1時間と1年ではかなりの時間節約になります。たとえ反応を生成するのに少し時間がかかってもです。他にも制限があることは言っておくべきですね。 ,"So an hour versus about a year is a pretty big time savings, even if it does take a little while to generate the response. Some other limitations, we should say."
HF_146_We_feed_mo.wav,私たちは、より多くのデータと計算資源を投入し、それによって時間と共に、GPT-2から3、そして4へと進化し、その過程で彼らはより賢くなっていきます。 ,"We feed more data and more compute into them, and then over time, we get from GPT-2 to 3 to 4, and they get smarter along the way. "
HF_147_I_m_in_ful.wav,私は、今夜すっかりホリデームードです。昨夜はあなたと一緒にホリデーパーティーに参加する機会もありましたね。,I’m in full holiday cheer this evening. I had a chance to go to a holiday party with you last night even.
HF_148_It_s_a_tim.wav,この時期は武器を置き、共通点を見つけようとしながら、来年に向けて注目度の高いインタビューを手に入れるための策を練る時間でもありますね,"It’s a time where we lay down our arms, and we try to find common ground and scheme to get high profile interviews in the coming year."
HF_149_As_it_seem.wav,先週の派手なAIデモの後、ようやく物事が落ち着き始めたように思えたけれど、…,"As it seemed like things were starting to settle after some wild A.I. demos last week,.."
HF_150_I_ve_been_.wav,私は一挙手一投足にすっかり夢中になっているよ, I’ve been totally obsessed with every twist and turn.
HF_151_we_talked_.wav,私たちは、ここでOpenAIが発表した新しいGPT-4oモデルについて話したけれど、一番印象的だったのはそのとてもフレンドリーな音声アシスタントだったね。,"we talked here about the announcement from OpenAI about their new GPT-4o model, which was most striking for this very flirty voice assistant."
HF_152_She_really.wav,彼女は本当にしっかりとしたストーリーを語っていて、それを一緒に振り返るべきだと思うよ。,"She really lays out quite a narrative, which I think we should walk through."
HF_153_This_reall.wav,これは私を逡巡させた。,This really threw me for a loop.
HF_154_I_look_for.wav,透明性のある形での解決を望む。,I look forward to resolution in the form of transparency.
HF_155_There_are_.wav,まだどうしても腑に落ちない点が2つある,There are still two things that aren't quite adding up for me.
HF_156_But_even_s.wav,でも、法的な問題はひとまず置いておいてさ、ケビン。これが世間のイメージにどう影響するかについて、君の考えを聞きたいんだよね。,"But even setting aside the legality of it, Kevin, I’m curious to get your thought on what this does for public perception. "
HF_157_The_reason.wav,"私がこれがスカーレット・ヨハンソンの件よりも実は大きな問題だと思う理由は、注目をそれほど集めていないにもかかわらず、OpenAIが今、人材争奪戦の最中だからだ。




","The reason I think this is actually a bigger deal than the Scarlett Johansson thing, despite it not getting nearly as much attention, is because OpenAI is in a talent war. "
HF_158_There_was_.wav,今週、GPT-4oモデルが発表された日に、第三者機関の推定によると、OpenAIの収益が20％以上急増したという報道がありました,"There was reporting this week that on the day that the GPT-4o model was announced, OpenAI’s revenue shot at more than 20 percent, according to third party estimates."
HF_159_I_think_th.wav,今週感じていたことを正しく表現するなら、「雰囲気の変化（vibe shift）」ってところかな。,I think the correct way to phrase what I’ve been feeling this week would be vibe shift.
HF_160_and_that_.wav,そして、そこで僕は話の筋を見失っちゃった。, …and that’s where I’ve lost the plot.
HF_161_I_have_an_.wav,エアマットレスを使ってるから、常に全体に空気が通ってる。,"I have an air mattress, so it’s blowing air through the whole thing all the time."
HF_162_When_it_ca.wav,最終的に、自分が選ばれたとき、ただ人の役に立ちたいと決めたんだ。,"When it came down to it and I was selected, I decided that I just wanted to help. "
HF_163_It_s_risky.wav,何かの最初のバージョンを試すのはリスクがある。というのも、バグがまだ修正中だったり、粗削りな部分が残っていることが多いからね。,"It’s risky to try the first version of anything because the bugs are still being worked out, usually there’s some rough edges."
HF_164_What_was_t.wav,回復期はどんな感じだった？,What was the recovery process like? 
HF_165_They_were_.wav,彼らは、行き詰まりがあるだろうと予想していた,They were expecting there to be hang ups. 
HF_166_How_intent.wav,カーソルが実際に反応するために、どれくらい集中して考える必要があるんですか？カーソルに対してどれくらい細かい制御ができるんですか？,How intently do you  have to think about it in order for the cursor to actually react? And how fine grain is the control you have over a cursor now.
HF_167_How_does_t.wav,このインプラントは、過去に人々が同じようなことをするために使ってきた他のものと比べて、どうなんですか？,How does this implant stack up to other things that people have been using to do similar things in the past.
HF_168_A_few_week.wav,数週間経った頃、カーソルの制御が効かなくなり始めたんだ。カーソルが勝手に漂い出して、右に動かしたいのに左に行ったり、下に動かせなかったりした,"A few weeks in, I just started losing control of the cursor is what it comes down to. It would start drifting on me, I would want it to go right and it would go left, I could not get it to go down."
HF_169_It_s_on_a_.wav,それは、彼らが予想していたものの3倍の規模なんだよ。,It’s on a scale of 3x what they were expecting.
HF_170_I_was_stil.wav,麻酔でそれなりに意識がもうろうとしていた,I was still pretty drugged up on anesthesia.
HF_171_Do_you_get.wav,ワクワクする？それとも、「ちょっと待って、今の科学で可能な範囲にとどめようよ」って言う感じ？,"Do you get excited or do you say, like, hey, wait a minute, let’s stick to what the science is capable of now？"
HF_172_Maybe_I_fa.wav,多分それに届かなくいと思うけど、全力を尽くさなかったら後悔するだろうね,"Maybe I fall short of that, but I’ll be damned if I don’t give it my all."
HF_173_My_hats_of.wav,あなたが快く手を挙げていることに、本当に敬意を表します。, My hats off to you for just being willing to put your hand up for it.
HF_174_Candidly__.wav,正直なところ、この記事をいくつか読んではみたけど、もっと知りたいんだ。というのも、スカーレット・ヨハンソンのフィルモグラフィーを調べ終わった後では、あまり時間が残っていなかったからね,"Candidly, while I read some coverage of this, I want to learn so much more because I only had so much time left over after I finished researching the filmography of Scarlett Johansson."
HF_175_I_would_sa.wav,OpenAIへの出資と自社のAIプロジェクトの間で、彼らはこの世界で間違いなく大きなプレイヤーだと、私は思う,"I would say between their stake in OpenAI and all of their own A.I. projects, they’re just a major player in this world."
HF_176_Just_set_t.wav,少し状況を説明してくれる?,Just set the scene for us a little bit. 
HF_177_If_you_ve_.wav,もし、FBI捜査官が自分のコンピュータの中に住んでいたらどんな感じだろうとずっと思っていたなら、今それが実現できるってこと。,"If you’ve always wondered what it would be like to have an F.B.I. agent living inside your computer, you can now have that."
HF_178_It_s_kind_.wav,良い一本を見つけるために、どれだけ多くのワイドレッグジーンズを試さないといけないかを考えると、ちょっと屈辱的だよね。,It’s kind of mortifying to think about how many wide legged jeans you need to find to find a good pair.
HF_179_We_re_not_.wav,それにおいて私たちは孤独じゃない,We’re not alone in that. 
HF_180_These_new_.wav,これらの新しいNPU（ニューラル・プロセッシング・ユニット）は、基本的にこれらのラップトップの性能をAppleの領域に押し上げています,"These new N.P.U.s, do propel the performance of these laptops basically in the realm of Apple now."
HF_181_It_is_rare.wav,この番組で同じ会社について2回連続で話すことは珍しい。しかし、DeepSeekに起こっていることは、ますます興味深く、そしてますます混乱していると言ってもいいだろう。,It is rare that we spend two consecutive episodes of this show talking about the same company. But I think it is fair to say that what is happening with DeepSeek has only gotten more interesting.
HF_182_Some_peopl.wav,一部の人々は、これはAI業界にとっての「スプートニク・モーメント」だと言っていて、すべての国が一斉に注目し、AIの軍拡競争に関心を持ち始める瞬間だということです。ChatGPTの公開以来、AI業界で最も重要な出来事だと言う人もいます。でも、ケイシー、この2日前に緊急ポッドキャストを収録して以来、何が起こったのか教えてくれませんか？,"Some people are calling this a Sputnik moment for the AI industry, when every nation perks up and starts paying attention at the same time to the AI arms race. Some people are saying this is the biggest thing to happen in AI since the release of ChatGPT. But Casey, why don’t you just catch us up on what has been happening since we recorded our emergency podcast episode just two days ago.  "
HF_183_Well__I_wo.wav,ここ最近の状況を簡単に伝えると、たぶん3つの話があると思います。ひとつ目は、市場調査会社によると、DeepSeekは最近iOSで190万回、Google Playストアで約120万回ダウンロードされたということです。,"Well, I would say that there have probably been three stories that I would share to give you a quick flavor of what’s been going on. One, a market research firm says DeepSeek was downloaded 1.9 million times on iOS in recent days and about 1.2 million times on the Google Play Store.  "
HF_184_We_are_bri.wav,今日は本腰を入れて議論を進めます。株式市場やアメリカのAI企業の反応ではなく、DeepSeekに関するより本質的な問いに焦点を当てた話をしたいからです。それはつまり、中国はDeepSeekやAI全般に関して何をしようとしているのかということです。さらに、アメリカ人がこの中国製AIアプリに熱中しているという事実が持つ地政学的な意味とは何か？ そして、それはDeepSeekのアメリカでの展望にどのような影響を与えるのか？,"We are bringing in the big guns today because we wanted to have a more focused discussion about DeepSeek that is not about the stock market or how the American AI companies are reacting to this, but is about one of the biggest sets of questions that all of this raises, which is, what is China up to with DeepSeek and AI more broadly? What are the geopolitical implications of the fact that Americans are now obsessing over this Chinese-made AI app? What does it mean for DeepSeek’s prospects in America?  "
HF_185_Jordan_has.wav,ジョーダンはこの会社を長い間追いかけています。彼のニュースレター兼ポッドキャスト「ChinaTalk」の大きなテーマの一つは、中国で何が起きているのかを文字通り英語に翻訳し、それを西洋の視聴者向けに分かりやすく伝え、最新の動向を追い続けることです。だからこそ、今週のエピソードにぴったりのゲストであり、この対談をとても楽しみにしています。,"Jordan has been following this company for a long time. And a big focus of “ChinaTalk,” his newsletter and podcast, has been translating, literally, what is going on in China into English, making sense of it for a Western audience, and keeping tabs on all the developments there. So perfect guest for the week’s episode, and I’m very excited for this conversation.  "
HF_186_I_have_lea.wav,最近、DeepSeekについて勉強する中で「ChinaTalk」から多くのことを学びました。だからこそ、ジョーダンが来てくれてとても楽しみです。では、彼を迎えましょう。,I have learned a lot from “ChinaTalk” in recent days as I’ve been boning up on DeepSeek. So we’re excited to have Jordan here. And let’s bring him in. 
HF_187_I_want_to_.wav,DeepSeekについて、そして彼らが実際に何をしたのかを話したいと思います。でもその前に、まず中国のAIエコシステムの基本的な状況を教えてもらえますか？というのも、ケイシーも私もあまりその分野を詳しく見てきたわけではないので。,"I want to talk about DeepSeek and what they have actually done here. But I’m hoping, first, that you can give us the basic lay of the land of the Chinese AI ecosystem, because that’s not an area where Casey or I have spent a lot of time looking.  "
HF_188_And_what_i.wav,そして注目すべきことは、大企業が本当のブレークスルーを生むこの種の研究協力を促進するための適切な組織的・制度的構造をうまく作り出せていないということだ。,And what is remarkable is the big organizations can’t quite get their head around creating the right organizational institutional structure to incentivize this type of collaboration in research that leads to real breakthroughs.  
HF_189_And_the_go.wav,そして、政府は過去数年間には本当にしてこなかった方法で注意を払い始めるでしょう。,And the government’s going to start to pay attention in a way which it really hasn’t over the past few years.  
HF_190_Right__And.wav,そうですね。そこをもう少し掘り下げたいのですが、西側の多くの人が中国のテクノロジー企業について知っていることの一つは、それらの多くが中国政府と密接に結びついており、中国の法律の下で政府がユーザーデータにアクセスできること、そしてこれらの企業が中国の検閲ガイドラインに従わなければならないということです。,"Right. And I want to drill down a little bit there, because I think one thing that most listeners in the West do know about Chinese tech companies is that many of them are inextricably linked to the Chinese government, that the Chinese government has access to user data under Chinese law, that these companies have to follow the Chinese censorship guidelines.  "
HF_191_And_it_jus.wav,それは全く実行しようとしなかった。そして、人々はそれを見て、「ああ、これは他のすべての中国企業と同じで、中国の支配政党と密接な関係を持っている」と思ったのだ。,"And it just of wouldn’t do it at all. And so people, I think, saw that and said, oh, this is like every other Chinese company that has this hand-in-glove relationship with the Chinese ruling party.  "
HF_192_But_DeepSe.wav,しかし、これまでのところ、DeepSeekは目立たない存在だった。だが、それももはや過去のことだ。そして、彼らを取り巻く状況は大きく変わろうとしている。,"But DeepSeek, thus far, has flown under the radar. But that is no longer the case. And things are about to change for them."
HF_193_Is_the_ope.wav,DeepSeek がここで行ったことのオープンソースの性質が、彼らと中国政府の間に対立が生じる可能性がある理由の一つだと思いますか？,Is the open-source nature of what DeepSeek has done here part of the reason that you think there might be conflict looming between them and the Chinese government?  
HF_194_This_is_so.wav,これはある程度解決された問題であり、中国と西洋のモデルの長期的な競争力について議論する際には、やや的外れな点もある。,This is sort of a solved problem and a bit of a red herring when talking about long-term competitiveness of Chinese and Western models.  
HF_195_So_there_h.wav,イーロン・マスクや他のアメリカの著名なテクノロジー関係者を含む一部の人々が、「DeepSeekは密かに密輸した禁止されたチップを隠し持っており、実際には彼らが公言しているカークランド・シグネチャーのチップでやりくりしているわけではない」と発言している。,"So there have been some people, including Elon Musk and other American tech luminaries, who have said, oh, well, DeepSeek has this sort of secret stash of these banned chips that they have smuggled into the country, and that actually they are not making do with the Kirkland Signature chips that they say they are.  "
HF_196_But_the_re.wav,しかし、本当の長期的な競争は、モデルの開発だけでなく、それを展開し、大規模に展開することにある。,"But the real long-term competition is not just going to be on developing the models, but deploying them, and deploying them at scale.  "
HF_197_It_s_one_t.wav,アメリカにあるモデルと同程度の能力を持つモデルを持つことと、実際に誰もが好きなだけそれを使えるだけのエネルギーを持つことは別の話です。,It’s one thing to have a model that is about as capable as the models that we have here in the United States. It’s another thing to have the energy to actually let everyone use them as much as they want to use them.  
HF_198_Like_for_m.wav,私にとって、アメリカがこの競争に負けていると思う決定的な瞬間は、中国がバーチャルな同僚や本当に驚異的なエージェントなど、技術の飛躍的進歩を最初に成し遂げたときです。それは「私たちはすぐに追いつき、より効率的に何かを見つけ出した」ということとは異なります。ジョーダン、あなたは違う見方をしていますか？,"Like for me, what would tip me over into oh, my gosh, America is losing this race, is China is the first one out of the gate with a virtual coworker, or like a truly phenomenal agent, some sort of leap forward in the technology as opposed to, we’ve caught up really quickly, and we’ve figured out something more efficiently. Jordan, are you seeing it differently than that?"
HF_199_And_then_j.wav,そして先週、OpenAIはAIエージェントの初版となる「Operator」を発表しました。  ,"And then just last week, OpenAI announced that it was launching Operator, which is its first version of an AI agent.  "
HF_200_And_unlike.wav,AnthropicやGoogleのものとは異なり、開発者であるか初期のテストプログラムに参加していなければアクセスできなかったのに対し、私たちはChatGPTの月額200ドルのProサブスクリプションにアップグレードするだけで試すことができます。,"And unlike Anthropic and Google’s, which you either had to be a developer or part of some early testing program to access, you and I could try it for ourselves by just upgrading to the $200-a-month Pro subscription of ChatGPT.  "
HF_201_Go_pull_al.wav,過去数年間の最も関連性の高い情報をすべて集めて、それを基にコラムが書けるような形で整理してくれ。それくらいなら、月200ドル払う価値は間違いなくあるよ。,"Go pull all of the most relevant information about this from the past couple of years, and maybe organize it in such a way that I might write a column based off of it. Like, yeah, that’s absolutely worth $200 a month to me.  "
HF_202_OK__So_Cas.wav,OK、じゃあケイシー、実際にオペレーターに頼んだことと、それが自律的に行ったことを説明してくれる？,"OK. So Casey, walk me through something that you actually asked Operator to do for you and what it did autonomously on its own.  "
