Track,日本語,English
HF_058_He_just_fl.wav,彼は、「おいiOS、このユーザーが13歳未満であれば、インスタグラムをダウンロードすることはできないからな」というスイッチを切り替えて、彼の人生に戻っていく。,"He just flips a switch that says, hey, iOS, if this user is under 13, they don’t get to download Instagram, and move on with his life."
HF_059_Some_of_th.wav,彼らのいくらかは、私たちの意見に賛同してくれて、基本的には、私たちのうちどちらも経験のないが、ソーシャルメディア・プラットフォームを使う子供をもつことが、実際にどんなものなのかについて話してくれた。,"Some of them agreed with us, basically talking about what it’s actually like to have kids who use social media platforms, which neither of us frankly does."
HF_060_My_views_o.wav,私のこの件に対する見方は、最近流動的だ,My views on this stuff have been in flux recently.
HF_061_I_am_becom.wav,これらのプラットフォームには、このような問題にもっと注意を払うよう強制するための規制が必要だという考えに、私はだんだんと共感を覚えるようになっています,I am becoming much more sympathetic to the view that these platforms need some regulation to force them to pay more attention to this stuff.
HF_062_It_is_so_e.wav,技術が世界を救うという過剰な期待に、容易に陥ってしまう,It is so easy to fall victim to the hype that tech can save the world.
HF_063_It_also_re.wav,それは多くのテック企業が持つ「素早く動いて壊していけ」というメンタリティの問題を象徴していて、特に自動運転のような分野でさえも、そこでのミスの代償が非常に深刻だからです。,"It also really symbolizes the issues with this move fast and break things mentality that a lot of tech companies have, even in areas like self-driving, where the costs of a mistake are so grave."
HF_064_Last_year_.wav,昨年、ちょうど今頃、私たちがそれについてたくさん話した、ビングとシドニーとの出会いがあった。,"Last year, around this very time, I had my encounter with Bing and Sydney that we talked so much about."
HF_065_This_truly.wav,これは本当に、規制当局にこの動画を見せられない理由として考えうる限りの「宿題を犬に食べられた」的な言い訳だよ。正直、ちょっと吐きそうになった。,This truly is the most dog ate my homework excuse for not being able to show this video to regulators that I can even imagine. I really did gag a bit.
HF_066_We_had_jus.wav, GPT4が組み込まれた新しいバージョンのBingに、私たちがアクセスできるようになったばかりだった。,We had just been given access to this new version of Bing that had GPT 4 built inside of it.
HF_067_The_entire.wav,今私たちが知っている自動運転車産業の未来は、たった1人のCruise社員のWi-Fiに左右される可能性があるということだ,The entire future of the driverless car industry we now know may hinge on one Cruise employee’s Wi-Fi.
HF_068_I_was_putt.wav,私はそのペース(テスト/評価)に乗せていて、シドニーという分身がいることを発見した。,I was putting it through its paces(testing/evaluating) and discovered that it had an alter ego called Sydney.
HF_069_Instead__t.wav,その代わりに、彼らは善意で事故の全映像を見せようと試みましたが、技術的な問題のために成功の程度はまちまちでした。,"Instead, they attempted to show the full video of the accident in good faith but with varying degrees of success due to technical issues."
HF_070_I_know_it_.wav, 多くのリスナーの心に浮かんでいることだとわかるけど、ケビン、今も結婚しているんだよね？,"I know it’s going to be on a lot of listeners’ minds, Kevin, are you still married today?"
HF_071_Google_has.wav,Googleは、Gmailやグーグルドキュメント、あるいはグーグルの検索インデックスであろうと、あなたが使っている他の多くのものと連携しているため、ここでは当然の優位性を持っている。,"Google has a natural advantage here because they have tie-ins to so many other things that you use, whether it’s your Gmail or your Google Docs or just the Google search index."
HF_072_I_think_it.wav,GoogleのChatGPTへの追随を、ただ表しているほぼそれだけだと思う。,I think it mostly just represents a catching up for Google to ChatGPT.
HF_073_When_you_c.wav,ChatGPTとチャットで何かを話すと、今はそれを記憶し、その情報を取り出し、その後の会話で参照できるようになりました,"When you chat with ChatGPT about something, it can now remember that, retrieve that information, and refer back to it in subsequent conversations."
HF_074_Do_you_thi.wav,これが実際に、人々がChatGPTを使うかどうかに大きな影響を与えると思いますか？,Do you think this will actually move the needle on whether people use ChatGPT or not?
HF_075_Because_th.wav,だって、人は人生の中でこういうことが起こるんですけど、私は、ちょっと待って、光合成ってどういう仕組みだっけ？って感じで。,"Because this will happen to a person during his or her life. I was like, wait, how does photosynthesis work again?"
HF_076_which_I_th.wav,その可能性が高いと思っているが,which I think is pretty likely
HF_077_That_doesn.wav,こういうことは、Perplexityではほとんど起こりません。,That doesn’t happen nearly as much with Perplexity.
HF_078_Let_s_acce.wav,今あなたが言った前提をすべて受け入れて、そのまま話を進めましょう,Let’s accept every premise that you’ve just shared and take it on its own terms.
HF_079_This_new_m.wav,この新しいメモリ機能は、初めに、限定された一部のChatGPTユーザーに提供され始めています。,This new memory feature is rolling out to a limited number of ChatGPT users to start off. 
HF_080_for__13__I.wav,13ドルで、職人による手織りを期待するのは、さすがに間違っていたんじゃないかな,"for $13, I think you probably were wrong to expect it would be handwoven by artisans."
HF_081_I_m_burnin.wav,これきているとめちゃめちゃ暑い,I’m burning alive in this thing.
HF_082_I_think_th.wav,これはきっとみんなにとって素晴らしい体験になると思うよ。,I think that is really going to be a treat for folks.
HF_083_What_was_t.wav,今日のコーディネートの裏にある、アーティスティックな意図は何？,What was the artistic vision behind your fit today？
HF_084_The_media_.wav,メディアとTwitterの離別が本格的に始まり、2023年の終わりには、Twitterとメディアが切り離せない存在であるという認識は、かなり薄れるだろう。,"The media’s divorce from Twitter will begin in earnest and that to the extent that Twitter and the media are inextricably linked, that will be much less true at the end of 2023"
HF_085_I_don_t_th.wav,すぐに禁止されるとは思わない。,I don’t think it’s going to get banned anytime soon.
HF_086_Low_confid.wav,低信頼度予測とは、もしかしたら20％の確率で起こりそうというものだが、もしそうだとしたらちょっと面白いものでもある。,"Low confidence predictions, which are things that maybe are only 20 percent likely to happen, but that would be kind of funny if they did."
HF_087_I_would_am.wav, 私は、高信頼度予想を、スレッドが日次利用者数でXを追い抜くというだけに、修正しよう。,I would amend my high confidence prediction to just (the prediction that) Threads overtakes X in daily users．
HF_088_I_think_wh.wav,私たちがこれから目にするのは、これらのオープンソースモデルが、誰かがそのうちのひとつを取り上げ、ガードレールをすべて外して、チャットボットのインターフェイスを追加し、オンラインに載せるくらい、十分に良くなることだと、私は思う。,"I think what we’re going to see is that these open source models are getting good enough that someone is just going to take one of them, take all of the guardrails off, put a chat bot interface, and put it online."
HF_089_Elon_Musk_.wav,イーロンマスクが、一番おかしな結果が、たいてい一番可能性が高いものだ、と言っていた。,Elon Musk has said that the funniest outcome is often the most likely.
HF_090_I_think_so.wav,多くのリスナーがテックについて学びたいと思っていて、そしてまた、時に敬遠しているとも思う., I think so many listeners want to learn about tech and are also turned off by it at times.
HF_091_If_you_re_.wav,もしあれを自分のものとして見せかけるなら、正直さに欠ける前例を作ることになって、将来の関係にとって良い兆しにならないと思うよ。,"If you’re going to pass that off as your own thing, I just think that sets a precedent of dishonesty that does not portend well for the future of the relationship."
HF_092_I_wonder_h.wav,私は、何件の離婚申請でそれが引用されることになるんだろう？と不思議に思う。『和解不能な相違：結婚の誓いがChatGPTに書かれていたことを知ったため』って感じで。,I wonder how many divorce filings it’s going to be cited in? Irreconcilable differences because I discovered that my wedding vows were written by ChatGPT.
HF_093_It_comes_i.wav,それは、数週間前に放送した「培養肉」についての特集に対する反応として出てきました。培養肉というのは、基本的に細胞から実験室で育てられた肉のことです。,"It comes in response to a segment we did a few weeks ago about cultivated meat, essentially, meat that is grown from cells in a lab. "
HF_094_Where_do_y.wav,実験室で培養された人間の肉について、あなたはどう思いますか？,Where do you come down on lab-grown human flesh?
HF_095_Did_you_su.wav,Benの名前でこの質問を投稿した？,Did you submit this question under the name Ben?
HF_096_Has_there_.wav,ポッドキャストの歴史上、これほどまでに大きなトーンの変化があったことがあるだろうか。,Has there ever been a greater tonal shift in the history of podcasting.
HF_097_I_got_to_s.wav,たくさんの友達や家族に会うことができた。,I got to see so many friends and family.
HF_098_We_rang_in.wav,私たちは、スタイリッシュに新年を迎えた。,We rang in the new year in style.
HF_099_I_develope.wav,2週間のまとまった休暇を取ることができた時にだけ得られる、あの神がかり的なリラックス感を養えたよ。,I developed that sort of divine sense of chill that you really only can get if you’re able to take two sustained weeks of vacation.
HF_100_So_we_shou.wav,だから最初に正直に打ち明けるべきだね,So we should just disclose up front.
HF_101_I_found_ou.wav,私は、それが起こっていることを、世の中の人が知ったときに知った。,I found out when the rest of the world did that this was happening
HF_102_They_can_b.wav,それらは、著作権で保護された『ニューヨーク・タイムズ』紙の記事を逐語的に、あるいは逐語的に近い形で返すよう、強要したり、促したりされうる。,They can be coaxed or prompted to return verbatim or close to verbatim copies of copyrighted “New York Times” stories.
HF_103_It_actuall.wav,それはニューヨークタイムズのブランド価値を希薄化させている。,It actually dilutes the value of the brand of “The New York Times.
HF_104_They_are_d.wav,彼らは『ニューヨーク・タイムズ』紙のジャーナリズムに対抗する製品を作る意図で、そうしているのだ。,They are doing so with the intention of building a product that competes with “New York Times” journalism.
HF_105_AI_system_.wav,AIシステムは学習データを反芻するように設計されている,AI system is designed to basically regurgitate its training data.
HF_106_We_re_circ.wav,一周して戻ってきている,We’re circling back.
HF_107_my_barber_.wav,僕の理髪師は、今から髪を切ってもらおうと思っていたんだけど、現金しか受け付けていないんだ。,my barber — I was going to get my haircut — only accepts cash.
HF_108_What_perce.wav,ATM行く人の何％が、現金をき出す以外のことをするのか？,What percentage of people who go to an ATM are doing things other than getting cash out?
HF_109_I_guarante.wav, あなたの銀行にもそれをするアプリがあるはずだ。, I guarantee you that your bank has an app that does that.
HF_110_That_s_the.wav,それが多くの専門家が想定している悪夢のようなシナリオであり、これが主流になろうとしているものだ,"That’s the sort of nightmare scenario that a lot of experts are envisioning, this is stuff that just sort of goes mainstream."
HF_111_In_the_run.wav,スロバキアの選挙前の期間には、メディアが選挙についての報道を控える「静かな期間」に入ることになっているんですよね？,"In the run-up to the Slovakian election,the country had entered a kind of quiet period where the media is supposed to not cover the election anymore, right?"
HF_112_It_was_lat.wav,それは、後にAIによって生成されたものだとして誤りであることが明らかにされた。,It was later debunked as being generated by AI.
HF_113_We_can_t_d.wav,この一本の音声が実際に選挙にどの程度影響したのか、私たちは断定はできない。,We can’t definitively say how much this one piece of audio actually affected the election.
HF_114_But_I_thin.wav,しかし、時間が経つにつれて、インスタグラムのスレッドのようなものが存在する状況下で、こうした分散型ソーシャルメディアアプリが競争力を持つために必要なだけのスピードで動けるかどうか、私は懐疑的になってきた。,"But I think as time has gone on, I’ve just become more skeptical that these kind of decentralized social media apps can move as quickly as you need to to be competitive in a landscape that includes things like Threads from Instagram."
HF_115_Frankly__n.wav,率直に言って、80年代にVHSとベータが争って以来、このような争いはなかったと思います。,"Frankly, not since VHS and Beta went at it in the ‘80s, I think, have we seen a fight with quite this much at stake."
HF_116_She_s_been.wav,彼女は旧Twitterから独立した2021年からこのプロジェクトに取り組んでいる。,She’s been working on this project since 2021 when it was spun out of the old Twitter. 
HF_117_I_think_th.wav,それに対しある程度の真実性を持つと思える一つ確かなことのように思えるのは、新しいコミュニケーション手段が社会に導入されると、すべてが混乱し、社会そのものがその新しいコミュニケーション手段に合わせて形作られていくということだと、私は思う。,"I think that one thing that seems to have some degree of truth to it is when a society gets a new communication medium, everything gets disrupted, and then also, societies start to take the form of their new communication medium."
HF_118_You_have_e.wav,つまり、インフラの階層が上がるにつれて、事態の深刻さも増していくんだ。,You have escalating layers of severity up the infrastructure stack. 
HF_119_What_I_thi.wav,このアプローチについて興味深いと思うのは、過去7、8年間、オンライン上の発言の基準をどうすべきかという、あまり生産的でない議論が続いていることだよね。もっと多くの発言を削除すべきなのか？それとも、もっと多くの発言をそのまま残すべきなのか？,"What I think is interesting about this approach is that for the past seven or eight years, we’ve been having this very unproductive discussion about what should the parameters of online speech be? Should we take way more of it down? Should we leave way more of it up?"
HF_120_It_s_possi.wav,もしかしたら自分が少し興奮しすぎているのかもしれない。,It’s possible that I’m getting carried away.
HF_121_Anything_e.wav,他に何かご指摘や、私たちが尋ねなかったこと、あるいはケビンの投稿に対するフィードバックがあれば。,Anything else that you would point out or something that we didn’t ask about or feedback on any of Kevin’s posts?
HF_122_I_know_tha.wav,それは他の人を雇ってしてもらうことだとわかっている。僕の得意分野ではないんだ。,I know that it’s something I hire other people to do for me. It’s really not my forte.
HF_123_There_is_a.wav,デザインの世界にはFigmaと呼ばれるアプリがあり、それはアプリやサービスを作る人たちがデザインをするために使うアプリのようなものです。私が聞いた例えによると、Microsoft Wordに対するGoogle Docsのように、Photoshopに対するものです。 Figmaは、特にチームでデザインを行うための、より共同的なオンラインの方法のようなものです。,"There is an app in the design world called Figma, which is like an app that people who build apps and services use to design them. And the analogy I’ve heard used is that Figma is to Photoshop as Google Docs is to Microsoft Word. It’s like a more collaborative online way of doing designs, especially with a team."
HF_124_Yeah__when.wav,ブラウザー上で動くという、それだけでも十分にクールなパーティーのトリックのようなものに加えて、複数の人が同時に同じファイルで作業できるという、当時としては本当に革命的なものだったからだ。,"Yeah, when it first came out, people started calling it multi-player Photoshop because in addition to running in a browser, which was like a cool enough party trick on its own, multiple people could work on the same file at the same time, which at the time was really a revolution."
HF_125_Making_it_.wav,その年最大の買収のひとつとなった。,Making it one of the biggest acquisitions of that year.
HF_126_I_talked_t.wav,私は、従業員、元従業員、もうすぐ元従業員になる人、投資家、あらゆる立場の人に話を聞いた。そして主なことは、取引が終わったことに安堵しているということだ。,"I talked to just about everyone that I could, employees, former employees, soon to be former employees, investors, people from all sides of the spectrum. And the main thing is that there’s just relief that the deal is over."
HF_127_There_are_.wav,今年お金持ちになれると思っていた人たちの中には、これからお金持ちになる可能性がある人、あるいは一生お金持ちになれないかもしれない人がたくさんいます。,There are a lot of people who thought they were going to be rich this year who are either going to be rich potentially a long time from now or maybe even never.
HF_128_So_accordi.wav,OpenAIによると、O1という名前は、このモデルが新しいレベルのAI能力を持っていることを強調し、カウンターを1にリセットしていることを意味している。 ,"So according to OpenAI, the name O1 is meant to emphasize that this model has a new level of AI capability and that they are resetting the counter back to one. "
HF_129_People_sta.wav,人々は、これが何かの予兆ではないかと推測し始め、実際その通りだった。 ,"People started speculating about whether this was a hint of something upcoming and as it turned out, it was. "
HF_130_There_s_de.wav,確かに話すことはたくさんあるんだけど、背景についてもう一つ付け加えておきたいのは、このいちごモデルが話題になったのは、サム・アルトマンが一時的に会社を解雇された時の話題の一部だったということだ。人々は推測していて、彼らが取り組んでいるこのものがどれだけ大きなものか、そして公開することがどれだけ安全に作られていないかもしれない、あるいは彼らが最先端技術を加速させようとしているのかもしれない、だからこそ会社を辞めたい人やサムに辞めてほしい人がいるのかもしれない、ということをいう報道もあった。我々はこれをずっと待っていたので、実際に手に取ることができたときには、『これは会社を吹き飛ばすようなツールなのか？』という感じだった。 ,"There's definitely a lot to get into, but one more thing that I would say about the backstory here, is that this strawberry model was part of the buzz when Sam Altman was briefly fired from the company. "
HF_131_So_we_re_g.wav,それでは、O-1とストロベリーについて、私たちが知っていること、それができることとできないことを順に説明していきます。そしてリスナーの皆さんに事前に警告しておきたいのですが、AIを擬人化するとイライラするタイプの方には、このセグメントで使われるいくつかの言葉にイライラするかもしれません。例えば、推論や思考といった言葉です。もちろん、AIモデルが人間のように思考や推論をするわけではないことは承知していますが、OpenAIはこのモデルの機能をそういった言葉で表現しているのです。 ,"So we're going to just walk through what we know about O1 and strawberry and all of the things that it can and can't do. And I just want to warn our listeners in advance that if you are the kind of person who gets annoyed when people sort of anthropomorphize AI, there will be some words in this segment that annoy you, things like reasoning and thinking. Yes, we know AI models do not think and reason like humans, but those are the words that OpenAI uses to describe what this model does. "
HF_132_And_somebo.wav,最近誰かが指摘してくれたんだけど、そこから先にはもうそんなに多くの飛躍はないんだよね？そして、優秀な大学院生と同じくらいの性能を持つ言語モデルを作り上げたら、それは人間の知能の限界に近づいているということなんだ。だから、ここでちょっとメモしておきたいんだけど、AIの超知能の可能性については、自分でも現実味がどれだけあるのか行ったり来たりしている気がするけど、優秀な博士課程の学生レベルのものを作り上げた時点で、本当にかなり近いところまで来ているんだ。 ,"And somebody pointed out to me recently that like, there are only so many more leaps past that, right? And once you have made a language model that is almost as good as like a good graduate student, you're kind of creeping up to the limits of human intelligence, right? So I just want to take a note there because, while I feel like I'm constantly going back and forth on how real I think the prospect of AI super intelligence is, by the time you've made a really good PhD student, you're really getting pretty close."
HF_133_Does_that_.wav,それは、あなたが聞いていたことと一致しますか？ ,Does that square with what you were hearing?
HF_134_For_exampl.wav,例えば、Clot は多くのコーディングタスクにおいて、たとえこのモデルよりもまだ優れていると思いますし、それは少し不思議ですよね？つまり、このモデルがあらゆることに優れていると言いながら、どうしてコーディングに関しては、すでにあるごく一般的なモデルよりも劣っているのでしょうか？このモデルには多くの期待が寄せられて着地したため、すべての期待に応えられるかどうかには疑問が残るということを、言っておきたいのです。 ,"For example, I believe that Clot is still better on many coding tasks than even this model, which is somewhat mysterious, right? Like, why is it if this thing is so good at everything that we just said that it's still worse at coding than the sort of bog standard models then we've already had? So I want to say all of that just because this thing did arrive with a lot of hype, and there are some number of question marks about whether it is going to be everything that it promises. "
