Track,日本語,English
HF_203_As_best_as.wav,私の知る限り、これが起こった理由は、Instacartがデフォルトで地元の食料品店を検索するようになっているからです。  ,"As best as I can tell, the reason it did this is that Instacart defaults to searching for grocery stores in the local area.  "
HF_204_And_the_se.wav,そして、このOperatorのインスタンスが動作していたサーバーはアイオワにありました。,And the server that this instance of Operator was running on was in Iowa.  
HF_205_Yes__I_had.wav,はい。私はまだいくつかの作業をする必要があり、ブラウザを操作してクレジットカード番号を入力しました。ドメイン名の登録のために住所の詳細を入力する必要がありました。また、このウェブサイトで利用可能なさまざまなホスティングプランの中から選ぶ必要がありました。しかし、作業の90%は自動で行われ、私は最後の部分だけを引き継いで行えばよかったのです。,Yes. I had to still do things take over the browser and enter my credit card number. I had to give it some details about my address for the registration for the domain name. I had to pick between the various hosting plans that were available on this website. But it did 90 percent of the work for me. And I just had to take over and do the last mile.  
HF_206_OK__So_if_.wav,OK。つまり、1か月ずっと稼働させていれば、おそらくOperator Proの費用をまかなうための200ドルをなんとか捻出できるかもしれませんね？,"OK. So if you had it going all month, presumably you could maybe eke out the $200 to cover the cost of Operator Pro?  "
HF_207_This_is_a_.wav,これは私にとって難問です。つまり、これらのアプリが偏ったことを吐き出すことがあるのは分かっています。,"This is a head-scratcher for me. I mean, we know that these apps can spit out biased things.  "
HF_208_Yeah__And_.wav,ええ。そして彼らは一緒に夜遅くまで働き、一部の人は文字通りオフィスで寝泊まりしているとも報じられています。連邦政府を縮小するために、ほぼ24時間体制で働いているのです。,"Yeah. And together, they’ve been pulling late nights, some of them reportedly literally sleeping in their offices, so that they can work basically around the clock to shrink the federal government.  "
HF_209_And_what_i.wav,そして、連邦政府で起きていることは、ツイッターよりもはるかに重要であるにもかかわらず、非常に似た形で展開している。,"And what is happening at the federal government, while it is infinitely more important than Twitter, is unfolding in a very similar fashion.  "
HF_210_And_he_s_j.wav,彼はワシントンの動向や、人々がイーロン・マスクの大規模な侵攻にどう反応しているかを的確に把握している。,And he’s just really got a feel for the pulse of Washington and how people are reacting to Elon Musk’s big invasion.  
HF_211_So__Jonath.wav,ジョナサン、ワシントンの様子を教えてください。イーロン・マスクとシリコンバレーのプログラマーたちが動き回り、連邦政府を削減しようとしている中、現地の雰囲気はどうなっていますか？,"So, Jonathan, give us the view from Washington. What is the vibe on the ground as Elon Musk and his band of Silicon Valley programmers move around, trying to cull the federal government?  "
HF_212_They_have_.wav,彼らは標的にされていますが、他の多くの機関も同様です。,"They have found themselves in the crosshairs, but so have a bunch of other agencies.  "
HF_213_They_have_.wav,彼らは標的にされていますが、他の多くの機関も同様です。,"They have found themselves in the crosshairs, but so have a bunch of other agencies.  "
HF_214_Well__this.wav,まあ、これは少し分かりにくいですね。そして、素晴らしい同僚たちに敬意を表したいと思います。,"Well, this is a little opaque to me. And I have to give credit to my wonderful colleagues.  "
HF_215_As_far_as_.wav,私が元当局者と話した限りでは、政治任命者がこれへのアクセスを求めた例は聞いたことがなく、ましてやアクセスが許可された例はありません。現在、彼らは「閲覧のみのアクセス」だと主張しており、つまり支払いを変更することはできないと言っています。しかし、それでも異例と見なされています。,"As far as I know from talking to former officials, they’ve never heard of a situation where a political appointee has requested access to this, let alone be granted access to it. Now they are insisting to us that it is, quote, unquote, read-only access, meaning they can’t alter payments. But even that is considered extraordinary.  "
HF_216_There_s_th.wav,この説が広まっていて、あなたの意見を聞きたいのですが、一部はただの陽動や戦術に過ぎないというものです。つまり、DOGEの人たちは、自分たちのしていることのすべてが合法ではないと分かっているし、そのすべてがトランプや議会の承認を得られるわけではないと認識しているというのです。,"There’s this theory floating around that I want to get your take on, that some of this is just a diversion or a tactic, that, basically, the DOGE folks, they know that not all the things they’re doing are legal. They know that not all of it will end up passing muster with Trump or with Congress.  "
HF_217_And_so_we_.wav,そして、彼がTwitterの従業員に対して行った扱いが、現在連邦政府の労働者に対して行っている扱いにも強く反映されているのがわかります。,And so we’re seeing so much of the way he treated Twitter employees reflected in the way that he’s now treating the workforce of the federal government.  
HF_218_I_credit_m.wav,これについては同僚のケイト・コンガーとライアン・マックの功績です。しかし、これは私たちのマスクに関する大きな記事の中で取り上げたことです。ええ。私たちの理解では、マスクの支持者たちは人工知能ツールを政府のシステムに導入しようとしています。そして、その目的は契約を評価し、削減を提案することだと言われています。,"I credit my colleagues for this, Kate Conger and Ryan Mac. But this was in our big story on Musk. Yes. So as we understand it, Musk’s allies aim to inject artificial intelligence tools into government systems. And the point, supposedly, is to use them to assess contracts and recommend cuts.  "
HF_219_I_credit_m.wav,これについては、同僚のケイト・コンガーとライアン・マックの功績です。しかし、これは私たちのマスクに関する大きな記事の中で取り上げました。そうです。私たちの理解では、マスクの支持者たちは人工知能ツールを政府のシステムに導入しようとしています。そして、その目的は契約を評価し、削減を提案することだと言われています。,"I credit my colleagues for this, Kate Conger and Ryan Mac. But this was in our big story on Musk. Yes. So as we understand it, Musk’s allies aim to inject artificial intelligence tools into government systems. And the point, supposedly, is to use them to assess contracts and recommend cuts.  "
HF_220_So_often_o.wav,この番組では、毎週のように皆さんに向けて、テクノロジーが生み出す課題や私たちが懸念していることをお伝えしていますが、感謝祭のエピソードを迎えるにあたって、ケビン、あなたと私は「今日はただ祝おう」と話し合いました。,"So often on this show, we come to you week after week, and we tell you about the challenges that technology is creating, the things that we’re worried about, but when it came time for our Thanksgiving episode, Kevin, you and I said to each other, maybe we could just celebrate today.  "
HF_221_I_am_going.wav,「Hard Fork」でこれをパクろうと思っている。  ,I am going to rip this off at “Hard Fork.”  
HF_222_It_was_suc.wav,すごくいいアイデアだったし、とても楽しかった。  ,"It was such a good idea, and it was so fun.  "
HF_223_And_I_thou.wav,それに、人類の誕生以来、驚くべき技術がたくさん生まれてきたと思った。  ,"And I thought, there has been so much incredible technology since the dawn of mankind. "
HF_224_And_frankl.wav,正直なところ、ケビン、僕たちの番組ではそのごく一部しか話していないよね。,"And frankly, Kevin, we’ve talked about very little of it on our show.  "
HF_225_It_means_t.wav,つまり、それは景観の中で確固たる位置を築いたものであり、私たちが行ったように、過去数千年の地球上の技術を総括するリストを作成するならば、これがそのリストに含まれるべきものである。,"It means that it has earned a place in the landscape as something where if you are putting together a list, as we did, of the technologies that really sum up the past few thousand years on Earth, this belongs on that list.  "
HF_226_That_s_rig.wav,そのとおりです。私たちはこれを素早く終わらせるつもりです。感謝祭の週末で予定があることは承知しています。ですので、慎重かつ迅速に進めていきます。,That’s right. We are going to try to get through these quickly. We know you have places to be on Thanksgiving weekend. So we’re going to do this very judiciously and expeditiously.  
HF_227_And_many_p.wav,多くの人々が広大な水域を泳いで渡ろうとして命を落としました。 そして彼らは気づきました。「待てよ、船を作って水を渡ればいいんじゃないか」と。,"And many people died trying to swim across large bodies of water. And then they figured out, wait a minute, we could make a craft to carry us across the water.  "
HF_228_Well__it_s.wav,ペッセ・カヌーと呼ばれていると考えられており、1955年にオランダで発見されました。約1万年前のものと考えられています。驚くべきことです。驚くべきことです。,"Well, it’s believed to be called the Pesse canoe, and it was discovered in 1955 in the Netherlands. It’s believed to be about 10,000 years old. Amazing. Amazing.  "
HF_229_Some_peopl.wav,一部の人々は、彼らが今後数年で復活する準備をしているかもしれないと考えています。,Some people think that they might be primed for a comeback in the coming years.  
HF_230_And_it_may.wav,また、スピニング・ジェニーの影響でイギリスの布の価格が下がり、安価な輸入品がアメリカ市場にあふれたことで、アメリカの商人たちを激怒させ、アメリカ独立戦争の一因となった可能性もある。,"And it may have also contributed to the American Revolutionary War because the spinning jenny caused the price of British cloth to fall, which flooded the US market with cheap imports and made American merchants very mad.  "
HF_231_6_second_l.wav,現在も続く短尺動画時代の幕開けとなった6秒間のループクリップ。,6 second looping clips that set the stage for the short-form video era that we still live in to this very day.  
HF_232_Because_th.wav,このせいで私は生地まみれよ。でもお金の話じゃなくて、クッキーやケーキ、パイを焼くための生地なの。聞いてちょうだい。,"Because this thing has me rolling in dough and not the money kind. It’s the kind that I’m using to bake cookies, cakes, pies. And let me tell you something.  "
HF_233_Translate_.wav,TranslateとZoomが登場し、本当に状況を一変させた。,Translate And Zoom came along and really changed the game.  
HF_234_It_s_a_lan.wav,それは対照的なものが共存する土地です。,It’s a land of contrasts.  
HF_235_And_then_a.wav,そして、リーナス・トーバルズが現れました。彼はこのオープンソースのオペレーティングシステムを作り、それを実際に無料で提供しました。そして、これによって多くの革新が生まれ、私たちは今でも人々がそれを基に構築し続けているのを目にしています。,"And then along came Linus Torvalds, Kevin, and he built this open-source operating system, and he actually gave it away for free. And this enabled so much innovation that we continue to see people build on to this very day.  "
HF_236_The_two_ot.wav,彼が提案したもう二つの名前は、オーディオブログとゲリラメディアだった。だから、もしそれらが定着していたら、今ごろこのポッドキャストをゲリラ的にやっていたかもしれないね。,"The two other names he suggested were audioblogging and guerilla media. So if those had taken off, you could be guerilla-ing this podcast right now.  "
HF_237_Oh__my_gos.wav,なんてことなの！昔はタイプライターで文字を打つだけで、すべての文字が同じ見た目だったなんて想像できる？そこにフォントが登場したんだよ、ケビン。,"Oh, my gosh, can you imagine there was a time when you would be just typing on your typewriter, and all the letters just looked one way? Along came fonts, Kevin.  "
HF_238_It_kicked_.wav,それは電子タバコやベイプの革命を引き起こし、多くの予期せぬ結果をもたらし、一世代全体をニコチンに依存させた。しかし、一方で一部の人々がタバコを吸うのを防いだ可能性もあり、タバコの使用率は低下している。,"It kicked off the e-cigarette or vaping revolution, which has had many unintended consequences and has hooked an entire generation on nicotine, but has also probably saved some people from smoking tobacco, and tobacco use has been falling.  "
HF_239_But_screws.wav,でも、ネジは本当に重要です。なぜなら、標準化されることで、突然、部品の互換性が生まれたからです。,"But screws, seriously, are important, because once they became standardized, all of a sudden, you could have interchangeable parts.  "
HF_240_Every_day_.wav,毎日、次から次へと届く荷物。多くの人にとって—そしてパンデミックがそれを大いに示したように—Amazon Primeは生活を楽にしてくれる。,"Every day, package after package. I think, for many of us — and did the pandemic illustrate this in a big way — Amazon Prime just makes life easier for people.  "
HF_241_I_would_pu.wav,これはMicrosoft Excelのカテゴリに入ると思う。極めて退屈だが、これなしでは世界が機能しなくなる技術だ。,"I would put this in the category of Microsoft Excel, extremely boring technology without which the world would cease to function.  "
HF_242_Here_s_why.wav,理由はこれです。ドルビーサラウンドサウンドが登場する前は、映画の音はそれほどかっこよくなかったんです。映画を観に行くという体験は、席に座って、大きなドルビーのロゴが出て、すごく大きな音が鳴って、それがかっこよく聞こえて、「スター・ウォーズ」は家で観るよりもずっといい音で楽しめると分かる、そういうものなんです。,"Here’s why. Because before Dolby surround sound, movies didn’t sound as cool. The whole experience of going to a movie is, you sit in the seat, and then you see the big Dolby thing, and they play the really loud noise, and it sounds cool, and you know that “Star Wars” is going to sound much better here than it’s going to sound at your house.  "
HF_243_We_would_a.wav,もしGPSがなければ、私たちは皆同時に迷ってしまうでしょう。,We would all be lost simultaneously if it weren’t for GPS.  
HF_244_For_more_o.wav,それについてもっと知りたいなら、聖書を読んでください。,"For more on that, you can read the Bible.  "
HF_245_Teslas_are.wav,テスラはとてもかっこいい車であり、この国の電気自動車革命を促進した功績があることは確かだ。,"Teslas are very cool cars, and they do deserve credit for catalyzing the electric car revolution in this country.  "
HF_246_And_if_we_.wav,もし過去に戻って火薬をなくし、剣を主体とした戦闘の世界に移行できるなら、私は賛成する。,"And if we could go back in time and get rid of the gunpowder and transition to a more swords-based combat universe, I’d be in favor of it.  "
HF_247_They_are_e.wav,視力が悪い人にとって、それは生活に欠かせないものです。,They are essential to life if you are a person with bad vision.  
HF_248_Slack_prom.wav,Slackはメールを置き換えて私たちの生活をより良くすると約束しましたが、実際にはメールに加えてやることを増やしただけで、むしろ悪化しました。,"Slack promised that it would replace email and make our lives better, and instead, it just gave us something in addition to do to email, and it was worse.  "
HF_249_And_that_c.wav,それが多くの摩擦を生み、時間とエネルギーを大量に消費しました。,And that caused a lot of friction and took a lot of time and energy.  
HF_250_Good_luck_.wav,これなしで人間の細胞を見るのは難しいでしょう。,Good luck seeing the human cell without one of these.  
HF_251_You_had_to.wav,おい、牛が欲しいんだけど、それってヤギ何匹分になるかな？,"You had to say, hey, I want a cow. About how many goats will that run me?  "
HF_252_It_s_such_.wav,祖先のように家畜で支払われるのではなく、お金で支払われるのは本当に安心する。,It’s such a relief to be paid in money and not in livestock the way our ancestors were.  
HF_253_Having_to_.wav,トップ8の友達を選ばな,"Having to pick your top eight friends and then watching them all jockey for position in your life so that they could be on your profile page, all of the fights that that started. Some of the first influencers and creators became popular on Myspace.  "
HF_254_Yes__And_t.wav,はい。そして私にとって、AlphaFoldは「AIはただの誇大広告だ」と言われたときに持ち出す例です。私はこう言います、「それならAlphaFoldを直視すべきだ。すでに成し遂げたこと、これから成し遂げようとしていることを考えれば、それがいかに驚異的であるかが分かるはずだ」と。,"Yes. And to me, AlphaFold is the thing that I go to when people say, AI is all hype. I say, then you need to reckon with AlphaFold, the things that it has already done, the things that it is about to do, because I think that it’s incredible.  "
HF_255_You_could_.wav,カセットテープに録音して、後にはCDにもできて、街を歩き回ることができた。まさにパーソナルテクノロジー革命の始まりだったと言えるだろう。,"You could put it on a cassette tape, later, a CD, walk around town, and the world was your oyster. It was really the start of the personal technology revolution, I would say.  "
HF_256_Yeah__Alex.wav,そうだね。アレクサンダー・グラハム・ベルは電話で本当に大成功を収めた。電話は電報に取って代わり、現代の通信の基盤になった。そして、長く成功した人生を送ったけど、最終的にテキストメッセージに殺されたと言えるだろう。今では誰も電話をかけなくなった。本当に残念だよ。,"Yeah. Alexander Graham Bell really popped off with telephones. They became sort of the foundation of modern communication, replacing the telegraph. And I would say they had a long and successful life until they were murdered by text messages. No one calls anymore. It’s really a shame.  "
HF_257_That_s_off.wav,それはメソポタミア人に対して失礼です。,That’s offensive to Mesopotamians.  
HF_258_Yes__I_wou.wav,はい。今ではほとんどの人がなくてはならないものになったと言えるでしょう。Wi-Fiがなかった時代を覚えています。パソコンを使うにはイーサネットケーブルを壁のポートに接続しなければなりませんでした。しかし、Wi-Fiはまったく新しい世界を開いたのです。,Yes. I would say it has crossed the chasm into things that most people today could not live without. I do remember a time before Wi-Fi. You had to plug in your computer to the wall using ethernet. But Wi-Fi sort of opened up an entirely new world.  
HF_259_Sounds_lik.wav,素晴らしい考えですね。そして、現在多くの課題に直面しているものの、ウェブが長く生き続けますように。,"Sounds like a great idea. And long may the web live, even though it’s under many challenges right now.  "
HF_260_And_everyt.wav,そして、2017年以降にAIで重要なものとして構築されたものはすべて、トランスフォーマーアーキテクチャの上に構築されています。,And everything that has been built in AI of any importance since 2017 has been built on top of the transformer architecture.  
HF_261_I_would_sa.wav,純粋な時間の観点から言えば、YouTubeはおそらく他のどのウェブサイトや技術よりも世界中の人々の注意を集めているだろう。,"I would say on a pure hours spent basis, YouTube probably consumes more of the world’s attention than basically any other website or technology.  "
HF_262_But_then_n.wav,しかし、誰も自分の動画をアップロードしたがらなかったため、彼らは誰でも好きな動画をアップロードできるように方向転換した。,"But then no one wanted to upload their videos, so they pivoted to letting anyone upload any videos they wanted.  "
HF_263_And_obviou.wav,そして明らかに、テレビはこの10年ほど苦境に立たされてきました。リニア放送の概念は衰退しており、かつてのような人気を取り戻すことはないかもしれません。なぜなら、ストリーミング型のエンターテインメントがそれに取って代わったからです。,"And obviously, television has had a rough past decade or so. The idea of the linear television broadcast is in decline, and may never be as popular as it once was, because streaming entertainment has popped up to replace it.  "
HF_264_The_thing_.wav,iPhoneというものは、ポケットに収まる長方形のガラスと機械の塊であり、それを使って世界中の情報を呼び出したり、誰とでも話したり、ビデオ通話で相手の顔を見たり、ゲームをしたり、楽しんだりすることができる。,"The thing about iPhone is that it is a piece of glass and machinery that is a rectangle that fits in your pocket, and you can use it to summon all of the world’s information, to talk to anyone, to see their face via a video call, to play a game, to entertain yourself.  "
HF_265_There_are_.wav,世界には、私たちが考慮に値すると見なすべき技術がさらに増えていくでしょう。,There are going to be more technologies in the world that could be worthy of our consideration.  
HF_266_But_this_o.wav,しかし、これはそのこととはまったく関係がなかった、少なくともサミットの公式プログラムの中では。,"But this one was very much not about that, or at least not in the official portion of the summit program.  "
HF_267_And_is_tha.wav,そして、それは最初の二つのサミットでAIの安全性の問題を完全に解決できたからですか？,"And is that because at the first two summits, they were able to solve the problem of AI safety once and for all?  "
HF_268_But_these_.wav,しかし、これらは同じ考えに対する、よりヨーロッパ的な別のアプローチだった。,But these were other more European approaches to the same idea.  
HF_269_Yeah__I_me.wav,そうですね、私もこの点には関心があります。というのも、ここ数年のAIの進歩や向上している能力が、実際に労働者の変化につながっている兆候を私たちは皆、待ち望んでいると思うからです。,"Yeah, I mean, this is something that I’ve been interested in too, because I think we’ve all been waiting for signs that the AI gains of the past few years, the progress and the capabilities that are improving, are actually translating into changes for workers.  "
